<!ELEMENT empresa (catalogo)>
<!ATTLIST empresa
    nombre CDATA #REQUIRED
    cif CDATA #REQUIRED>
<!ELEMENT catalogo (categoria+)>
<!ATTLIST catalogo fecha CDATA #REQUIRED>

<!ELEMENT categoria (producto*)>
<!ATTLIST categoria nombre CDATA #REQUIRED>

<!ELEMENT producto (nombre, precio, descuento?, imagen, url_ref)>
<!ATTLIST producto
    id ID #REQUIRED
    stock (si|no) "si">
<!ELEMENT nombre (#PCDATA)>
<!ELEMENT precio (#PCDATA)>
<!ATTLIST precio moneda CDATA #FIXED "EUR">

<!ELEMENT descuento (#PCDATA)>
<!ELEMENT imagen (#PCDATA)>
<!ELEMENT url_ref (#PCDATA)>